{
  "schemaVersion": "1.0",
  "adapter": "libplctag",
  "adapterVersion": "@ADAPTER_VERSION@",
  "protocol": "ethernetip",
  "upstream": {
    "name": "libplctag",
    "version": "2.7.2",
    "revision": "7712ed7f1ee05ba0ebfca641b3f5c43da52a66ed",
    "license": "MPL-2.0 OR LGPL-2.0-or-later",
    "language": "C",
    "independentEngine": true
  },
  "roles": {"server": true, "client": true},
  "fixtures": ["logix"],
  "clientOperations": ["get-attribute", "set-attribute", "get-attributes-all", "identity", "read-tag", "read-tags", "write-tag", "tag-list"],
  "clientFeatures": {
    "listIdentityTcp": false,
    "listIdentityUdp": false,
    "listServices": false,
    "getAttributeSingle": true,
    "setAttributeSingle": true,
    "getAttributesAll": true,
    "multipleService": false,
    "unconnectedSend": false,
    "class3": true,
    "class1": false,
    "largeForwardOpen": true,
    "multicast": false,
    "inputOnly": false,
    "listenOnly": false,
    "logixTags": true,
    "readTagFragmented": true,
    "writeTagFragmented": false,
    "readModifyWrite": true,
    "tagList": true,
    "templates": false,
    "configData": false
  },
  "serverFeatures": {
    "listIdentityTcp": false,
    "listIdentityUdp": false,
    "listServices": false,
    "listInterfaces": false,
    "getAttributeSingle": false,
    "setAttributeSingle": false,
    "getAttributesAll": false,
    "getAttributeList": false,
    "multipleService": true,
    "unconnectedSend": true,
    "class3": true,
    "class1": false,
    "largeForwardOpen": true,
    "multicast": false,
    "inputOnly": false,
    "listenOnly": false,
    "configData": false,
    "logixTags": true,
    "readTagFragmented": true,
    "writeTagFragmented": true,
    "readModifyWrite": false,
    "tagList": false,
    "templates": false,
    "tcpipObject": false,
    "ethernetLinkObject": false,
    "errorsCloseSession": false
  }
}
